<?xml version="1.0" encoding="utf-8" standalone="no"?><UY5E1L_kurzusfelvetel xmlns:xs="http://www.w3.org/2001/XMLSchema-instance" xs:noNamespaceSchemaLocation="UY5E1L_kurzusfelvetel.xsd">

    <hallgato evf="r_evfoly">
        <hnev>Béla</hnev>
        <szulev>2001</szulev>
        <szak>Programtervező informatikus</szak>
    </hallgato>
    <kurzusok>
        <kurzus id="1" nyelv="magyar">
            <kurzusnev>Adatkezelés XML-ben</kurzusnev>
            <kredit>5</kredit>
            <hely>A1 XXXII. ea</hely>
            <idopont>Kedd 14:00</idopont>
            <oktato>Dr. Bednarik László</oktato>
        	<óraadó>Óraadó tanár2</óraadó>
        </kurzus>
        <kurzus id="2" jovahagyas="igen" nyelv="angol">
            <kurzusnev>Numerical and optimization methods</kurzusnev>
            <kredit>5</kredit>
            <hely>A1/312</hely>
            <idopont>Wednesday 10:00</idopont>
            <oktato>Dr. Házy Attila</oktato>
        <óraadó>Óraadó tanár3</óraadó></kurzus>
        <kurzus id="3" jovahagyas="igen" nyelv="magyar">
            <kurzusnev>Valószínűség-számítás</kurzusnev>
            <kredit>5</kredit>
            <hely>A1/319</hely>
            <idopont>Hétfő 10:00</idopont>
            <oktato>Dr. Fegyverneki Sándor</oktato>
        <óraadó>Óraadó tanár4</óraadó></kurzus>
    </kurzusok>
</UY5E1L_kurzusfelvetel>